{
  "approval_source": "local_cli",
  "approved_at": "2026-10-14T21:43:30.806669+00:00",
  "approver_label": "local-user",
  "displayed_fingerprint": "e30a7cf09dc59b73291c8e34437c1679867354c51d128498d75f4193a5141a58",
  "investigation_id": "ncc-2022-cosluxe-vietnam-entry",
  "projection": {
    "adaptation_envelope": {
      "allowed_operations": [
        "bounded_retry",
        "reduced_concurrency",
        "dependency_safe_topology_reduction"
      ],
      "compatible_participant_substitution": true,
      "dependency_safe_topology_reduction": true,
      "evidence_reuse": true,
      "fallback_on_stale_reuse": "stop",
      "max_concurrency_reduction": null,
      "max_retries": 1
    },
    "brief": {
      "assumptions": [
        "Vietnam entry begins in 2023 and stable-growth planning begins from 2024 onward.",
        "Workbook facts retain their stated source, period, units, and dummy-case status.",
        "First entry category means the initial priority category, not exclusion of the remainder of the portfolio.",
        "Offline and ecommerce measures are not comparable until definitions, periods, and units are normalized.",
        "The 8% growth ambition is a planning target, not an observed result."
      ],
      "consequence_level": "high",
      "current_direction": "Build a traceable category-by-channel scorecard and keep any recommendation provisional until category growth, portfolio fit, consumer relevance, channel dynamics, competitive intensity, and execution constraints are reconciled.",
      "decision_question": "Which Personal Care category should Cosluxe Nature enter first in Vietnam, and which channels should it prioritize across 2023-2025 to support stable growth of at least 8% from 2024 onward?",
      "desired_deliverables": [
        "A traceable category-attractiveness screen identifying a provisional first-entry category and its evidence.",
        "A three-year channel-prioritization and phasing recommendation for 2023-2025.",
        "Target consumer, price-tier, and premium-natural positioning hypotheses with explicit assumptions.",
        "A conditional growth bridge showing whether the proposed category-channel choices could support the 8% planning target from 2024 onward.",
        "Risks, evidence gaps, trigger conditions, and an executive presentation outline within the case's suggested maximum of 20 slides."
      ],
      "execution_intent": {
        "preferred_capabilities": [],
        "preferred_participants": [],
        "preferred_patterns": [],
        "preferred_reasoning_controls": {},
        "required_capabilities": [
          "spreadsheet_read"
        ],
        "required_participants": [],
        "required_patterns": [
          "sequential"
        ],
        "source": "wayfinding"
      },
      "horizon": "2023 entry; 2023-2025 channel plan; stable-growth planning from 2024 onward",
      "investigation_id": "ncc-2022-cosluxe-vietnam-entry",
      "next_useful_step": "Normalize MAT TY versus MAT YA and MAT 2YA measures, reconcile them with channel and consumer evidence, and open the category and channel decision questions for review.",
      "open_dependencies": [
        "Confirm launch budget, margin, supply, distribution, and portfolio-cannibalization constraints with the client.",
        "Confirm whether the recommendation optimizes revenue, profit, market share, reach, or a weighted combination.",
        "Confirm acceptable external desk-research scope and evidence-quality threshold for claims beyond the workbook.",
        "Reconcile category definitions and channel boundaries across the named workbook sheets.",
        "Validate whether the 2023-2025 horizon and 2024 growth baseline match the client's planning calendar."
      ],
      "scope": [
        "Vietnam Personal Care category performance in offline channels using MAT 2YA, MAT YA, and MAT TY measures ending September 2022.",
        "Vietnam Personal Care ecommerce category growth, new launches, and survival of new launches.",
        "Vietnam consumer price-tier movement, essential and routine category perceptions, channel penetration, and shopping frequency.",
        "Vietnam traditional-trade regional and urban-rural dynamics, modern-trade store universe, and channel value sales.",
        "Cosluxe Nature portfolio focus, premium image, and natural-ingredient positioning as stated in the case materials."
      ],
      "stages": [
        {
          "dependencies": [],
          "expected_result": "A source and metric dictionary with observed-versus-derived labels and unresolved comparability issues.",
          "limits": {},
          "objective": "Inventory workbook sources, definitions, periods, units, and comparability limits before calculating attractiveness.",
          "participants": [
            "analyst"
          ],
          "research_needs": [
            {
              "kind": "STRUCTURED_DATA",
              "query": "Inspect the Case and Glossary sheets for business objectives, category definitions, source notes, and period conventions.",
              "source_hint": "data/exercise1-nielsenIQ/NCC 2022 - Semi Final Case - Data set.xlsx; sheets Case and Glossary"
            },
            {
              "kind": "STRUCTURED_DATA",
              "query": "Inventory measures, units, and source notes across Macro & FMCG, Personal Care, Consumer, Channel Dynamic, Trad.Trade, Modern Trade, and Ecommerce.",
              "source_hint": "data/exercise1-nielsenIQ/NCC 2022 - Semi Final Case - Data set.xlsx; sheets Macro & FMCG, Personal Care, Consumer, Channel Dynamic, Trad.Trade, Modern Trade, Ecommerce"
            },
            {
              "kind": "VALIDATION",
              "query": "Confirm whether offline, ecommerce, value, volume, store, penetration, and frequency measures can be compared directly.",
              "source_hint": "data/exercise1-nielsenIQ/NCC 2022 - Semi Final Case - Data set.xlsx; source notes and headers"
            },
            {
              "kind": "STRUCTURED_DATA",
              "query": "Explicitly decide whether the hidden Others sheet is included in the first-pass evidence boundary.",
              "source_hint": "data/exercise1-nielsenIQ/NCC 2022 - Semi Final Case - Data set.xlsx; hidden sheet Others"
            }
          ],
          "skill_ids": [],
          "stage_id": "source-audit",
          "subtasks": []
        },
        {
          "dependencies": [
            "source-audit"
          ],
          "expected_result": "A reproducible category scorecard with sensitivity to alternative weights and explicit unresolved assumptions.",
          "limits": {},
          "objective": "Compare candidate Personal Care categories on growth, scale, consumer relevance, portfolio fit, and competitive or launch signals.",
          "participants": [
            "analyst"
          ],
          "research_needs": [
            {
              "kind": "QUANTITATIVE_ANALYSIS",
              "query": "Calculate MAT TY versus MAT YA and MAT 2YA growth, scale, and category contribution for candidate categories.",
              "source_hint": "data/exercise1-nielsenIQ/NCC 2022 - Semi Final Case - Data set.xlsx; sheet Personal Care"
            },
            {
              "kind": "QUANTITATIVE_ANALYSIS",
              "query": "Compare ecommerce growth, new-launch intensity, and survival of new launches by candidate category.",
              "source_hint": "data/exercise1-nielsenIQ/NCC 2022 - Semi Final Case - Data set.xlsx; sheet Ecommerce"
            },
            {
              "kind": "EXISTING_EVIDENCE",
              "query": "Connect consumer essentiality, face or body care relevance, price-tier movement, and Cosluxe portfolio fit to category hypotheses.",
              "source_hint": "data/exercise1-nielsenIQ/NCC 2022 - Semi Final Case - Data set.xlsx; sheets Consumer and Case"
            }
          ],
          "skill_ids": [],
          "stage_id": "category-screen",
          "subtasks": []
        },
        {
          "dependencies": [
            "source-audit"
          ],
          "expected_result": "A phased channel recommendation linked to shopper reach, frequency, store economics, regional dynamics, and category fit.",
          "limits": {},
          "objective": "Determine which traditional trade, modern trade, and ecommerce channels should lead, follow, or support the entry plan across 2023-2025.",
          "participants": [
            "analyst"
          ],
          "research_needs": [
            {
              "kind": "QUANTITATIVE_ANALYSIS",
              "query": "Compare Personal Care value sales and growth across modern trade, traditional trade, and ecommerce.",
              "source_hint": "data/exercise1-nielsenIQ/NCC 2022 - Semi Final Case - Data set.xlsx; sheets Channel Dynamic, Trad.Trade, Modern Trade, Ecommerce"
            },
            {
              "kind": "EXISTING_EVIDENCE",
              "query": "Reconcile channel penetration and shopping frequency with store-universe and regional or urban-rural dynamics.",
              "source_hint": "data/exercise1-nielsenIQ/NCC 2022 - Semi Final Case - Data set.xlsx; sheets Consumer, Modern Trade, Trad.Trade"
            },
            {
              "kind": "VALIDATION",
              "query": "Test whether proposed phasing is consistent with the chosen category's launch and distribution requirements.",
              "source_hint": "Derived category-channel scorecard"
            }
          ],
          "skill_ids": [],
          "stage_id": "channel-screen",
          "subtasks": []
        },
        {
          "dependencies": [
            "category-screen",
            "channel-screen"
          ],
          "expected_result": "A joint category-channel assessment with explicit trade-offs, alternative weights, and conditional growth logic.",
          "limits": {},